product_id,product_name,category,sub_category,brand,description,price,cost,stock_quantity,reorder_level,supplier_id,is_discontinued,created_date,last_updated
1192,Stuff Women,Clothing,Women,Rice-Johnson,Enjoy lot bit cause model relationship.,818.69,430.74,420,29,4,0,2023-03-27,2026-01-08 09:35:34.952821
1193,Real Kitchen,Home,Kitchen,Becker and Sons,Property audience surface serious thousand read.,251.34,163.16,383,93,76,0,2024-12-11,2026-01-08 18:38:52.525868
1194,Couple Accessories,Electronics,Accessories,"Blackburn, Mueller and Hernandez",Order sound across somebody.,726.39,478.62,195,68,56,1,2024-06-30,2026-01-20 20:31:50.933002
1195,Sea Men,Clothing,Men,Carson PLC,Almost resource improve write leg.,433.58,287.07,275,69,12,0,2023-09-25,2026-01-16 13:51:11.716632
1196,Center Phones,Electronics,Phones,Walker LLC,Mother blue lose dinner too place decision.,562.07,314.43,386,44,78,0,2024-10-18,2026-01-12 19:10:06.760390
1197,At Women,Clothing,Women,Townsend and Sons,Each central top case find number.,127.97,67.77,439,39,38,0,2023-12-09,2026-01-10 08:06:37.334263
1198,Police Indoor,Sports,Indoor,Ramsey Ltd,Run attorney discuss agency chair give letter.,595.81,338.31,96,54,53,0,2024-04-24,2026-01-09 14:03:48.304461
1199,Sense Women,Clothing,Women,Byrd Ltd,Stop pattern change know prove new.,604.91,338.9,117,50,33,0,2022-09-19,2026-01-05 15:28:11.047821
1200,Quickly Indoor,Sports,Indoor,"Riddle, Mccoy and Evans",Threat seat again learn oil single one.,120.5,55.75,269,68,56,0,2023-11-13,2026-01-09 17:44:07.020106
1201,Case Accessories,Electronics,Accessories,"Martinez, Campos and James",Far customer peace story can.,446.38,220.16,415,56,23,0,2022-03-05,2026-01-11 05:09:52.752915
1202,Realize Kids,Clothing,Kids,Reese-Clark,Manager expect game that success catch quite.,465.96,283.2,317,37,71,0,2023-10-04,2026-01-13 02:38:14.989121
1203,Voice Furniture,Home,Furniture,"Richard, Lee and York",Effect where air film challenge friend animal.,337.75,227.63,420,22,74,0,2024-04-02,2026-01-06 07:10:11.749597
1204,Check Kids,Clothing,Kids,"Rodriguez, Mccormick and Cunningham",Your everyone conference agent relationship.,682.62,318.63,413,99,48,0,2023-02-18,2026-01-16 02:47:23.051381
1205,Cover Fitness,Sports,Fitness,Jones Inc,Happen keep upon perform.,660.58,433.49,218,97,55,0,2023-06-02,2026-01-21 06:06:44.505935
1206,Out Furniture,Home,Furniture,"Harris, Olson and Hughes",Conference cold ahead pass.,228.41,164.74,441,80,52,0,2022-11-13,2026-01-07 16:03:51.785442
1207,Who Laptops,Electronics,Laptops,Beck-Hanson,Every only relate wall practice fast item fight.,468.49,231.66,267,45,1,0,2024-12-01,2026-01-01 05:06:48.652529
1208,Billion Kitchen,Home,Kitchen,Pineda Group,Official eight door realize.,127.46,72.51,233,47,36,0,2024-10-05,2026-01-09 08:34:33.600869
1209,Down Fitness,Sports,Fitness,"Campbell, Wise and Davis",Worry million seat write country.,415.46,191.76,220,77,76,0,2024-12-24,2026-01-11 00:46:22.804363
1210,Receive Outdoor,Sports,Outdoor,Rich-Sandoval,Author may hand writer real.,289.29,207.25,358,22,56,0,2024-05-25,2026-01-18 19:25:33.413628
1211,Maintain Laptops,Electronics,Laptops,Michael PLC,Situation Republican wrong claim third part they.,661.7,312.51,41,23,98,0,2023-12-22,2026-01-08 08:06:57.446273
1212,Recently Decor,Home,Decor,Evans PLC,Nice stock wait discover soon vote politics.,794.57,466.51,172,70,62,0,2024-05-02,2026-01-18 23:30:38.110777
1213,Good Indoor,Sports,Indoor,Mueller PLC,Yet six late war if property.,474.92,365.31,173,29,70,1,2024-10-03,2026-01-17 19:13:20.910779
1214,So Accessories,Electronics,Accessories,George-Ortega,Executive care enjoy agency some.,91.43,52.48,149,53,73,0,2024-05-11,2026-01-09 03:07:18.581597
1215,Themselves Women,Clothing,Women,Jones Ltd,Mission event everyone artist guess page.,757.57,348.68,188,98,82,1,2022-10-26,2026-01-02 22:28:21.581831
1216,His Furniture,Home,Furniture,Wilson-Malone,Each she training since. Dark carry whom for.,969.43,442.06,142,61,98,0,2023-02-26,2026-01-20 12:18:23.512001
1217,Design Kitchen,Home,Kitchen,"Avila, Bean and Leblanc",Since successful every tree contain current.,401.32,207.22,404,49,63,0,2022-11-25,2026-01-16 06:58:00.949173
1218,Up Furniture,Home,Furniture,Newman-Booker,Practice true strong issue still sound.,140.08,72.18,461,53,23,1,2022-10-21,2026-01-09 18:26:10.284244
1219,Tax Laptops,Electronics,Laptops,Meyer-Mccarthy,Another blood word color.,742.87,416.56,85,62,58,0,2022-07-29,2026-01-15 14:28:46.407026
1220,Risk Furniture,Home,Furniture,Williams-Ballard,Me bill soon range.,675.73,423.02,441,50,69,0,2023-11-23,2026-01-15 18:27:51.492643
1221,Tend Indoor,Sports,Indoor,"Porter, Lindsey and Morris",Late bit hear shoulder figure or age fire.,739.65,373.56,447,58,66,0,2022-08-01,2026-01-14 18:17:56.286082
1222,Alone Outdoor,Sports,Outdoor,Allen-Brown,Blood white able score yes wonder practice.,406.93,261.06,125,72,72,0,2023-09-05,2026-01-05 08:09:32.189942
1223,Establish Outdoor,Sports,Outdoor,Davis-Bradshaw,Defense rise unit herself.,266.46,164.92,9,30,3,0,2023-11-17,2026-01-11 15:58:27.399394
1224,Strong Women,Clothing,Women,Williams PLC,Allow exactly public anyone control source.,454.0,276.89,170,30,79,0,2022-03-23,2026-01-05 17:26:14.356748
1225,Candidate Laptops,Electronics,Laptops,Scott-Lowe,Force law simply natural.,566.58,323.14,188,38,91,1,2024-08-06,2026-01-14 05:46:31.440872
1226,Impact Indoor,Sports,Indoor,Taylor Ltd,Size himself surface its myself body easy common.,524.47,264.47,24,47,50,0,2022-11-15,2026-01-15 12:45:03.499667
1227,Issue Outdoor,Sports,Outdoor,Schmidt-Johnson,Century the customer not court trial behind.,45.04,30.54,216,47,33,0,2022-10-03,2026-01-04 08:47:42.239283
1228,Attack Furniture,Home,Furniture,Evans-Carter,Police day spring claim medical environmental.,484.67,316.29,260,96,49,0,2023-12-24,2026-01-15 12:31:53.752646
1229,Arm Men,Clothing,Men,Stevens-Clarke,Sing buy box back page want.,516.6,270.92,77,45,29,0,2024-06-27,2026-01-02 02:26:03.623158
1230,Paper Fitness,Sports,Fitness,"Soto, Baker and Hill",Morning Mr fear almost stand success.,369.56,213.73,431,26,58,0,2022-07-05,2026-01-13 02:14:30.214219
1231,Hair Laptops,Electronics,Laptops,"Arias, Robinson and Hurst",Design he road second ground once show.,320.74,154.22,236,79,55,0,2022-11-03,2026-01-15 21:55:30.785393
1232,Course Outdoor,Sports,Outdoor,Bennett Group,Near TV middle situation gas run probably.,423.59,197.12,227,88,41,0,2024-04-05,2026-01-10 03:45:19.309919
1233,Guy Indoor,Sports,Indoor,"Torres, Baker and Stafford",Back account their same.,237.76,136.16,395,67,79,0,2024-10-23,2026-01-12 13:45:43.961823
1234,Task Decor,Home,Decor,"Johnson, Wade and Wolf",Popular company information catch.,192.29,123.52,257,62,18,0,2023-07-29,2026-01-02 21:35:27.610426
1235,Than Women,Clothing,Women,"Allen, Martinez and Richards",Make west avoid attack film.,755.59,376.2,449,23,97,0,2022-11-10,2026-01-15 11:48:19.885547
1236,Tend Indoor,Sports,Indoor,"Norton, Peterson and Wright",Seven listen since however reflect Republican.,424.4,235.54,144,23,34,0,2023-05-01,2026-01-02 03:21:38.104259
1237,Purpose Laptops,Electronics,Laptops,White-Walker,In floor family national find.,345.74,213.52,157,96,57,0,2024-06-23,2026-01-12 20:19:59.059150
1238,Everybody Women,Clothing,Women,Garcia-Jennings,Air especially list tell final read.,77.19,48.69,241,46,84,0,2022-06-09,2026-01-03 20:45:18.771541
1239,Camera Accessories,Electronics,Accessories,Lowery-Williams,Decide tend media front bank.,595.41,296.24,329,25,74,0,2024-03-23,2026-01-13 08:21:25.686508
1240,Amount Laptops,Electronics,Laptops,Lee-Mcfarland,Bed example least hour no baby soldier.,307.15,189.44,259,39,31,0,2023-07-12,2026-01-09 05:08:58.289040
1241,Challenge Kitchen,Home,Kitchen,Davis-Thornton,Sister security soon garden as threat dinner.,274.99,125.86,409,62,84,1,2022-09-06,2026-01-19 13:13:17.487580
1242,Choose Furniture,Home,Furniture,"Vasquez, Bell and Johnson",Moment popular relationship call rest my like.,254.83,174.27,102,36,53,1,2022-02-28,2026-01-20 00:50:18.251314
1243,Goal Accessories,Electronics,Accessories,"Wright, Thompson and Horton",Cause your tonight former night down.,729.24,343.35,390,21,5,0,2023-04-10,2026-01-01 01:55:57.999268
1244,Democrat Outdoor,Sports,Outdoor,"Cook, Mullins and Santiago",Mr address rather view staff concern.,777.04,428.46,40,28,8,0,2022-07-31,2026-01-11 00:33:07.639478
1245,Task Decor,Home,Decor,Gardner Inc,Away four Mr laugh TV.,939.77,494.85,422,73,10,0,2023-12-03,2026-01-06 00:44:09.425229
1246,Next Indoor,Sports,Indoor,"Johnson, Williams and Stewart",World much total choice minute.,684.69,496.84,52,60,65,0,2022-04-05,2026-01-17 18:28:25.484455
1247,Education Indoor,Sports,Indoor,"Conner, Norris and Castaneda",Long moment some often sign now relate.,279.09,203.89,373,59,61,1,2022-11-15,2026-01-10 22:05:22.148657
1248,Season Outdoor,Sports,Outdoor,Glass-Gibson,Dream even think indicate figure environment.,512.45,257.81,209,85,63,0,2022-09-22,2026-01-01 16:40:10.032663
1249,Simply Decor,Home,Decor,Blake Inc,My sport report behind huge analysis up.,426.13,233.47,204,69,71,0,2024-11-19,2026-01-03 16:17:22.252853
1250,Community Accessories,Electronics,Accessories,"Dominguez, Bray and Gill",Ability marriage however college push safe.,269.16,189.57,206,63,77,0,2022-10-10,2026-01-07 10:04:04.811469
1251,Seek Accessories,Electronics,Accessories,Ponce Group,Still of discussion spend matter down.,439.26,322.74,367,41,90,0,2023-05-23,2026-01-13 23:05:08.716867
1252,Take Men,Clothing,Men,White Group,Size one treat spring street data.,665.59,366.35,95,83,55,0,2024-10-21,2026-01-16 02:10:21.607636
1253,Adult Laptops,Electronics,Laptops,"Miller, Figueroa and Cline",A finish walk discuss front office.,247.36,142.73,123,99,69,1,2022-04-16,2026-01-07 10:29:56.647903
1254,Food Men,Clothing,Men,Vasquez-Anderson,World reflect listen treat.,51.56,38.21,34,47,12,1,2023-10-26,2026-01-19 02:29:56.091435
1255,Yard Outdoor,Sports,Outdoor,Mcpherson-Wolfe,Security organization example play speak last.,248.53,157.62,444,51,28,0,2023-04-27,2026-01-05 17:10:09.795725
1256,Daughter Kitchen,Home,Kitchen,Bradley-Shepherd,Goal a something.,644.03,367.95,85,53,59,0,2022-06-10,2026-01-01 23:31:58.640541
1257,Year Furniture,Home,Furniture,Hoffman-Terrell,Order by build imagine left people.,10.08,6.32,134,56,14,0,2024-05-18,2026-01-11 09:33:09.722365
1258,Water Kids,Clothing,Kids,"Callahan, Bailey and Rogers",Tree member bad state information see.,204.95,116.84,330,48,46,0,2023-11-05,2026-01-05 05:22:14.401081
1259,Scene Indoor,Sports,Indoor,"Pope, Wiley and Donovan",Wall year teacher government professional manage.,329.74,158.5,254,81,39,0,2022-01-21,2026-01-13 03:47:18.393897
1260,Continue Men,Clothing,Men,Smith-Odonnell,Together reduce price.,1031.16,484.84,39,84,87,0,2024-12-22,2026-01-15 04:42:10.601159
1261,Relationship Phones,Electronics,Phones,Mcbride-Collier,Agreement door could result either item.,296.03,180.89,136,73,99,0,2022-04-26,2026-01-18 16:56:10.345561
1262,Tv Laptops,Electronics,Laptops,Patterson-Delacruz,Particularly enough happen serve.,202.66,108.97,269,88,47,0,2022-06-07,2026-01-16 05:35:24.925696
1263,Fine Laptops,Electronics,Laptops,Schmitt Group,Safe tree employee high decade Congress.,442.54,277.44,448,99,80,0,2023-06-10,2026-01-20 15:43:41.223140
1264,Include Decor,Home,Decor,"Brown, Gonzales and Walsh",Try pay economy hundred instead morning outside.,893.68,443.67,38,41,71,1,2025-01-14,2026-01-11 18:14:28.005253
1265,A Kitchen,Home,Kitchen,Sutton-Chavez,Short author road lay life step however ever.,832.07,404.79,498,34,49,1,2023-11-07,2026-01-21 01:36:11.908536
1266,Entire Decor,Home,Decor,Zimmerman Inc,Pattern me vote weight if large.,165.97,93.02,482,32,76,0,2023-06-12,2026-01-04 12:50:07.347186
1267,Event Decor,Home,Decor,Atkins Ltd,Join speak fall cause everything maybe when.,693.76,382.29,280,25,94,0,2023-12-22,2026-01-16 02:23:37.209004
1268,Join Kids,Clothing,Kids,Nelson Ltd,Training them fund court cause population.,56.99,37.19,197,44,34,0,2022-03-06,2026-01-13 15:39:38.286009
1269,Over Women,Clothing,Women,Berry Group,Peace school defense ten.,637.48,457.79,311,67,74,1,2022-05-26,2026-01-13 11:21:51.465105
1270,Open Men,Clothing,Men,Robinson-Allen,Economic become quite position.,826.0,421.01,52,42,9,0,2023-06-07,2026-01-20 02:51:40.854643
1271,Enjoy Women,Clothing,Women,Newton-Schmitt,Itself dinner receive entire.,708.91,452.78,44,57,93,1,2024-04-04,2026-01-19 13:45:39.793090
1272,Choose Phones,Electronics,Phones,Baxter LLC,Bit leader listen Congress.,205.45,128.48,328,65,47,0,2024-03-28,2026-01-07 18:34:02.810807
1273,Simply Phones,Electronics,Phones,"Lloyd, Santiago and Riddle",Radio save stay.,218.63,163.76,30,59,38,0,2022-09-10,2026-01-15 14:29:07.275969
1274,Defense Indoor,Sports,Indoor,Frank Ltd,Officer onto likely. Organization pay point wide.,511.85,268.75,51,26,79,1,2023-03-20,2026-01-01 10:24:19.065851
1275,Front Decor,Home,Decor,"Whitney, Munoz and Rivera",Across management pay her interview enough.,525.11,276.77,160,60,59,1,2023-09-27,2026-01-20 12:18:01.504457
1276,Toward Outdoor,Sports,Outdoor,"Harvey, Robinson and Reed",Six city peace race.,592.01,375.91,453,58,16,0,2024-12-09,2026-01-19 17:54:03.179399
1277,After Phones,Electronics,Phones,Rojas-Gray,Party actually once be unit they money.,382.11,206.27,463,96,35,0,2023-08-15,2026-01-17 17:05:23.250447
1278,Center Men,Clothing,Men,Fischer-Garcia,Check race fill blue.,405.04,211.4,478,99,94,0,2023-06-28,2026-01-08 08:35:39.121347
1279,During Laptops,Electronics,Laptops,Fry Group,Partner ability ready prevent word matter.,1033.19,485.99,383,68,83,1,2023-07-24,2026-01-21 04:18:29.308484
1280,He Phones,Electronics,Phones,Taylor Group,Son agent piece case north.,67.54,34.14,430,87,82,0,2023-11-10,2026-01-21 09:10:06.839882
1281,Police Kids,Clothing,Kids,Carney-Bradley,Open long check arm loss.,260.14,128.78,63,71,69,0,2024-02-06,2026-01-01 04:21:02.217805
1282,Tonight Fitness,Sports,Fitness,"Sutton, Webb and Rodriguez",Safe consider by drop.,665.07,462.9,42,83,46,1,2023-07-09,2026-01-17 20:32:50.067409
1283,Last Kids,Clothing,Kids,Hill-Nichols,Big clear risk management or short here.,804.77,392.17,291,68,19,0,2022-08-22,2026-01-02 21:43:48.178658
1284,Growth Kids,Clothing,Kids,Erickson LLC,Loss apply tonight fund grow executive religious.,252.63,139.14,477,31,96,0,2024-07-02,2026-01-12 03:48:52.689416
1285,Campaign Laptops,Electronics,Laptops,"Miller, Harris and Woods",Hold human unit method hospital.,408.34,286.51,409,65,64,0,2022-06-17,2026-01-01 10:49:16.076813
1286,The Kids,Clothing,Kids,Valenzuela-Blackburn,Then trial style bring another thing you.,424.12,315.51,103,40,19,0,2023-02-17,2026-01-19 16:57:07.398618
1287,Choose Accessories,Electronics,Accessories,Mcpherson-Carson,Whole well he hold. Rise bed rate toward.,704.79,332.2,136,91,44,1,2024-07-01,2026-01-12 14:27:18.918662
1288,Compare Women,Clothing,Women,"Rios, Harris and Smith",Fast protect against place wish.,726.66,403.51,480,35,19,0,2024-07-15,2026-01-19 03:25:58.844720
1289,Civil Laptops,Electronics,Laptops,"Perry, Ward and Maldonado",Material probably paper ball between.,360.26,170.67,415,25,43,0,2024-02-06,2026-01-07 12:00:15.262365
1290,Marriage Kids,Clothing,Kids,"Mitchell, Luna and Garcia",Too stuff those charge should me street small.,786.8,474.12,412,68,6,0,2022-02-24,2026-01-19 09:37:29.590357
1291,Short Phones,Electronics,Phones,"Lloyd, Cruz and Jones",Although whether group cut power.,812.65,396.69,134,21,54,0,2022-04-09,2026-01-12 13:21:13.046406
1292,Cut Kitchen,Home,Kitchen,Parker-Williamson,Represent prove usually certainly view sit.,292.41,135.43,204,97,44,0,2022-08-27,2026-01-14 11:17:48.173555
1293,Which Laptops,Electronics,Laptops,"Norman, Cordova and Fry",Offer party major brother material.,815.73,435.96,497,94,65,0,2022-07-25,2026-01-21 05:02:04.522691
1294,Hear Indoor,Sports,Indoor,Bryant Inc,Physical anyone oil ten issue hundred.,738.67,481.65,18,32,50,0,2023-08-30,2026-01-21 09:14:18.835601
1295,Newspaper Kitchen,Home,Kitchen,Steele-Jordan,Although edge full tend speak glass.,604.8,403.6,286,82,68,1,2023-11-21,2026-01-11 19:36:28.607209
1296,Decade Indoor,Sports,Indoor,"Ruiz, Bates and Thomas",Often body now poor sure as early.,471.06,215.66,500,98,80,0,2024-04-06,2026-01-21 09:18:44.383532
1297,Hold Phones,Electronics,Phones,"Stephens, Morales and Young",Follow door machine generation let.,427.71,197.73,213,36,18,0,2022-09-15,2026-01-17 15:00:56.828785
1298,Tough Phones,Electronics,Phones,York-Fields,Heavy current my full owner.,833.97,400.69,284,68,2,0,2023-02-02,2026-01-16 09:08:35.050146
1299,Scene Fitness,Sports,Fitness,Jackson and Sons,Car heavy article contain wear the eye.,281.18,142.16,462,30,97,0,2023-10-21,2026-01-01 04:25:11.758687
1300,Modern Kids,Clothing,Kids,Jones-Gonzalez,Space buy order include Mr.,21.15,13.25,389,52,67,0,2022-08-27,2026-01-18 21:27:36.574688
1301,Mr Kids,Clothing,Kids,Stevens Ltd,Surface necessary century one eat from mouth.,172.06,88.4,148,59,10,0,2023-06-11,2026-01-15 08:15:12.203562
1302,Little Kitchen,Home,Kitchen,"Berry, Byrd and Mcconnell",Deal claim order bag soon role that.,793.76,405.4,490,66,30,0,2025-01-15,2026-01-16 09:24:23.129592
1303,Close Outdoor,Sports,Outdoor,Glover-Pitts,Time somebody job several race.,517.05,282.59,451,31,95,1,2022-05-26,2026-01-09 03:04:44.213114
1304,Generation Outdoor,Sports,Outdoor,Yoder-Solis,Write fast away.,655.44,321.6,169,48,17,1,2024-06-11,2026-01-06 08:08:32.129114
1305,Leader Outdoor,Sports,Outdoor,Holmes-Woods,Officer voice rule agree actually nice.,619.57,404.88,261,86,52,1,2023-07-26,2026-01-12 14:10:13.132230
1306,Network Kitchen,Home,Kitchen,"Conway, Sanchez and Thomas",Edge necessary what protect.,496.19,345.94,456,41,48,0,2024-02-22,2026-01-04 16:25:35.744524
1307,Room Kids,Clothing,Kids,Young PLC,It month another with cover single fund question.,882.33,453.59,461,20,98,0,2023-07-31,2026-01-07 21:26:55.122212
1308,Me Men,Clothing,Men,"Ellis, Crane and Cunningham",Moment country participant.,188.34,126.51,223,85,66,0,2023-05-06,2026-01-09 20:04:47.900555
1309,Ask Fitness,Sports,Fitness,Taylor Inc,Hope which for power.,698.59,365.11,425,74,63,1,2022-03-28,2026-01-04 14:56:37.841523
1310,Clearly Fitness,Sports,Fitness,Fuller and Sons,Prove here attorney four not keep.,30.46,14.14,142,61,71,0,2024-07-23,2026-01-20 08:38:37.347936
1311,Under Indoor,Sports,Indoor,Graham-Smith,Mission business before develop white prove.,669.34,368.36,425,93,61,0,2023-10-10,2026-01-18 13:18:13.589889
1312,Poor Men,Clothing,Men,Moore PLC,Guy everyone financial either seat more spring.,223.53,119.37,41,81,42,0,2024-06-06,2026-01-09 20:19:30.393352
1313,Dog Decor,Home,Decor,Crosby PLC,Worry grow front year goal. Born floor west.,673.75,316.11,358,99,63,0,2023-12-31,2026-01-13 16:14:15.019048
1314,Give Indoor,Sports,Indoor,Jenkins-Torres,Pay his forward particular how floor though.,92.14,48.06,361,57,68,1,2024-07-14,2026-01-18 12:05:16.453658
1315,Structure Women,Clothing,Women,"Rose, Weeks and Wilson",Research community my better.,445.85,224.66,429,35,79,1,2022-12-10,2026-01-07 19:27:54.367906
1316,Start Indoor,Sports,Indoor,"Ramirez, Sanders and Diaz",Manage center idea.,263.04,170.65,208,65,41,0,2023-08-30,2026-01-12 02:17:38.901019
1317,Everything Decor,Home,Decor,Eaton-Smith,How soldier throw technology sing movement.,463.12,220.74,313,71,57,1,2022-09-05,2026-01-21 17:21:27.759776
1318,Section Kids,Clothing,Kids,Davis-Thomas,Among discussion executive bad life year seek.,18.11,8.93,289,46,45,0,2023-06-10,2026-01-02 23:00:47.547536
1319,Hundred Phones,Electronics,Phones,"Bullock, Henderson and Bright",Chance book learn member evening matter base.,296.0,201.02,19,30,98,0,2022-12-16,2026-01-10 08:59:39.411950
1320,Trouble Fitness,Sports,Fitness,"Adams, Day and Hodges",President particular civil grow audience.,467.81,321.45,143,38,17,0,2023-03-21,2026-01-01 19:05:30.289329
1321,Worry Women,Clothing,Women,Martinez Inc,Account while arm PM market defense.,712.68,387.29,245,68,53,0,2022-12-20,2026-01-05 08:45:19.563679
1322,Top Kitchen,Home,Kitchen,"Lewis, Smith and Nielsen",Rest suddenly beat begin suffer fish small.,442.54,329.18,42,84,5,0,2022-12-05,2026-01-07 21:06:15.120144
1323,State Phones,Electronics,Phones,"Rocha, Thompson and Barron",Anything set role. Else those big perform issue.,160.58,102.28,2,29,43,0,2022-08-18,2026-01-08 20:19:25.576913
1324,While Fitness,Sports,Fitness,"Ward, Allen and Price",Perform common bit. Mouth science deal sense.,251.49,124.8,269,71,52,1,2022-09-06,2026-01-18 15:22:20.402231
1325,Think Laptops,Electronics,Laptops,"Gonzalez, Benton and Cooper",Foreign current appear marriage consumer matter.,257.32,166.52,450,22,45,0,2024-05-31,2026-01-03 12:32:47.472887
1326,Team Women,Clothing,Women,Kim-Zimmerman,Total mention risk she.,53.06,25.25,248,54,96,1,2023-09-22,2026-01-17 16:37:46.739211
1327,Production Women,Clothing,Women,Barnes Group,Those wall leg training.,135.0,72.34,383,46,51,0,2024-04-24,2026-01-21 15:04:20.857515
1328,Worry Phones,Electronics,Phones,Anderson Inc,Walk particular TV what body since real impact.,433.72,301.65,271,64,53,1,2023-11-09,2026-01-17 03:53:49.489575
1329,Old Kids,Clothing,Kids,Jennings PLC,Total gun modern contain city part three.,248.11,185.39,43,65,42,0,2022-12-02,2026-01-07 23:10:35.648955
1330,Left Men,Clothing,Men,"Salazar, Trevino and Lewis",Politics off station eight security natural rule.,578.22,338.42,447,60,71,0,2023-02-21,2026-01-05 07:24:46.629313
1331,Member Phones,Electronics,Phones,"Castaneda, Rush and Lewis",Respond material quickly number face get.,328.67,196.21,111,97,48,1,2022-08-07,2026-01-05 21:38:39.180811
1332,Learn Fitness,Sports,Fitness,Armstrong LLC,Issue again sound guess.,403.09,258.44,202,20,58,0,2025-01-07,2026-01-03 21:54:15.083637
1333,Whole Indoor,Sports,Indoor,"Collins, Alvarado and Smith",Wrong rock else east skin during seat.,91.5,45.68,288,92,13,0,2024-10-14,2026-01-09 21:30:12.126174
1334,Speak Indoor,Sports,Indoor,"Massey, Gregory and Wright",Window other bit heart seven on. Senior all week.,259.33,190.45,293,55,39,0,2023-08-13,2026-01-16 03:53:46.186078
1335,Expect Decor,Home,Decor,Rodriguez-Barajas,Say such any watch happen.,628.37,391.47,344,32,55,0,2022-05-14,2026-01-03 12:26:41.917706
1336,Leader Kids,Clothing,Kids,"Mccullough, Duncan and Stokes",Article mean oil whole.,755.63,380.87,264,63,85,1,2022-06-04,2026-01-05 03:40:10.523450
1337,Could Kitchen,Home,Kitchen,"Fernandez, Fernandez and Garcia",Style show others course assume more.,363.88,225.25,399,60,75,0,2022-08-21,2026-01-03 02:49:28.338925
1338,Create Outdoor,Sports,Outdoor,Allen-Gonzales,At health what participant.,289.39,184.01,313,53,84,0,2024-09-26,2026-01-05 15:05:41.763042
1339,Throw Furniture,Home,Furniture,"Thomas, Nichols and Garrett",Wish himself question.,830.98,492.08,241,83,14,0,2024-06-17,2026-01-01 16:25:55.556004
1340,Air Fitness,Sports,Fitness,Gamble-Jordan,Stand authority investment camera find.,130.54,91.49,1,94,35,0,2023-04-21,2026-01-02 21:00:03.583435
1341,Game Indoor,Sports,Indoor,Baker PLC,Dinner under event try.,911.4,473.57,152,34,45,0,2022-12-16,2026-01-11 17:58:28.915526
1342,Marriage Decor,Home,Decor,"Mcbride, Brown and Rasmussen",Right floor network military mouth matter into.,331.36,234.59,26,26,15,0,2022-04-27,2026-01-04 20:00:24.706359
1343,Discuss Decor,Home,Decor,Cochran-Brooks,Scene involve research.,222.0,129.87,117,56,79,0,2024-10-23,2026-01-01 02:20:19.939235
1344,Simple Kids,Clothing,Kids,"Beltran, Johnson and Wilson",Air education maintain consider result.,85.29,40.52,134,88,62,0,2024-03-26,2026-01-15 09:09:08.654047
1345,Turn Women,Clothing,Women,"Stokes, Castillo and Henry",Rest prove simply about laugh.,811.81,471.58,256,63,52,0,2022-09-09,2026-01-10 08:19:28.818446
1346,Order Phones,Electronics,Phones,Davis-Schultz,Civil blue party.,328.81,174.59,374,82,40,0,2024-12-13,2026-01-04 12:28:28.589972
1347,Evidence Fitness,Sports,Fitness,"Jackson, Gonzalez and Medina",Child memory toward name.,316.03,167.76,239,47,80,0,2024-08-14,2026-01-19 20:56:27.887538
1348,Store Men,Clothing,Men,Clark-Walsh,Summer local poor.,768.46,431.05,494,67,45,0,2023-03-18,2026-01-06 14:31:43.393500
1349,Laugh Kitchen,Home,Kitchen,Kerr LLC,Specific key professor Congress pass.,588.72,374.68,249,66,65,0,2023-06-03,2026-01-01 10:20:40.303374
1350,Health Indoor,Sports,Indoor,"Becker, Griffin and Taylor",Account society difference state.,54.09,26.93,465,87,99,0,2024-06-22,2026-01-19 21:09:56.248555
1351,Day Phones,Electronics,Phones,Hartman-Ruiz,Buy ground alone environmental between.,315.35,208.22,379,58,57,0,2023-11-30,2026-01-03 09:56:49.601900
1352,Room Furniture,Home,Furniture,Bradley-Lewis,East may here attention three former.,358.99,235.18,413,95,57,0,2023-04-04,2026-01-03 18:15:24.892380
1353,Now Decor,Home,Decor,Marks-Price,Couple determine down dream southern himself.,931.54,489.64,250,51,38,0,2024-04-10,2026-01-19 04:14:27.080696
1354,Experience Decor,Home,Decor,Becker PLC,Others population manager.,261.9,163.07,21,86,92,0,2023-06-25,2026-01-14 01:54:02.914245
1355,There Indoor,Sports,Indoor,"Barber, Gray and Webb",Carry right lose impact city dream.,377.23,189.57,18,35,60,0,2023-07-23,2026-01-06 01:35:49.210915
1356,Partner Kids,Clothing,Kids,"Walter, Jones and Baker",Future run out can many argue pretty about.,574.64,413.2,39,78,45,0,2022-04-09,2026-01-14 20:13:49.433506
1357,Hear Phones,Electronics,Phones,"Mayo, Barnes and Sanchez",Husband time wife deal again new.,295.61,221.97,196,78,74,0,2024-02-09,2026-01-04 01:21:31.448810
1358,Rule Laptops,Electronics,Laptops,Alexander Ltd,Suggest form soon at off speech well space.,528.58,273.78,91,87,41,0,2024-11-01,2026-01-20 14:13:34.710026
1359,Most Laptops,Electronics,Laptops,"Curtis, Anderson and Gibson",Agreement parent fund great where prove tree.,651.69,452.41,383,66,75,0,2023-06-03,2026-01-05 01:54:26.035582
