product_id,product_name,category,sub_category,brand,description,price,cost,stock_quantity,reorder_level,supplier_id,is_discontinued,created_date,last_updated
681,End Indoor,Sports,Indoor,"Jackson, Mann and Williams",Capital government yet if.,119.96,82.67,406,67,20,0,2023-02-12,2026-01-20 12:43:26.507690
682,Fine Fitness,Sports,Fitness,Jennings-Wilson,Real talk sort. Guess pattern natural.,395.93,250.05,208,68,2,0,2022-04-12,2026-01-20 06:58:06.323002
683,Must Outdoor,Sports,Outdoor,"Atkins, Harris and Fox",Skill instead generation.,835.65,406.38,158,89,55,0,2023-01-04,2026-01-21 07:15:02.010092
684,Actually Outdoor,Sports,Outdoor,Weber and Sons,Woman air him.,315.09,151.68,78,73,52,0,2022-05-09,2026-01-06 13:26:47.128449
685,Interesting Men,Clothing,Men,Davis-Chavez,Interview there under.,394.84,179.89,187,84,47,0,2023-08-29,2026-01-12 02:07:05.899735
686,Mrs Laptops,Electronics,Laptops,"Kelly, Chambers and Long",Myself dog source never each it which.,913.69,477.67,34,76,30,0,2022-10-24,2026-01-20 19:22:15.938370
687,Bar Indoor,Sports,Indoor,"Watkins, Pham and Morales",President small memory star.,642.39,405.44,27,64,68,1,2023-10-16,2026-01-07 01:18:15.412535
688,Fast Laptops,Electronics,Laptops,Peters LLC,Financial PM paper score wall plant treatment.,105.32,68.83,38,46,32,0,2024-10-24,2026-01-07 20:04:34.279071
689,South Kitchen,Home,Kitchen,"Mann, Fischer and Nichols",Issue without top teacher.,386.03,285.75,192,53,94,0,2023-01-18,2026-01-19 14:39:26.205228
690,Month Men,Clothing,Men,Edwards-Hunter,Friend let learn right painting their.,542.42,341.6,480,79,75,0,2023-12-31,2026-01-04 06:08:42.719065
691,Art Decor,Home,Decor,Smith-Perry,Month position music else.,422.66,232.82,376,30,98,1,2023-03-01,2026-01-07 14:11:41.862041
692,Owner Fitness,Sports,Fitness,Edwards-Ford,Born speak improve individual.,966.82,468.68,207,94,28,1,2023-01-04,2026-01-07 16:22:10.177760
693,Boy Kitchen,Home,Kitchen,"Carpenter, Parks and Espinoza",Really major decision happy change.,796.96,443.16,99,61,92,1,2023-04-17,2026-01-17 10:12:32.726552
694,Church Decor,Home,Decor,Jimenez Ltd,Sport himself role much result station.,577.48,336.92,280,20,48,1,2024-07-13,2026-01-09 21:23:01.173521
695,Million Phones,Electronics,Phones,"Castillo, Black and Torres",Heart seat series important natural.,1065.25,485.43,355,81,61,0,2022-04-28,2026-01-14 06:09:32.234010
696,Skill Furniture,Home,Furniture,"Krueger, Travis and Meyer",Single low development until degree long.,867.75,428.49,51,92,24,0,2023-12-24,2026-01-14 06:04:55.084418
697,Police Accessories,Electronics,Accessories,Schmitt LLC,More street often.,318.66,183.14,111,44,19,1,2022-01-21,2026-01-12 12:14:41.866772
698,Hotel Kids,Clothing,Kids,Tate PLC,Quite must future discover growth collection.,128.36,70.96,440,71,38,0,2022-08-28,2026-01-21 04:29:01.416912
699,Information Phones,Electronics,Phones,"Brock, Matthews and Price",Every senior relationship.,926.18,434.95,164,50,98,0,2022-05-07,2026-01-02 00:37:40.248080
700,Teach Indoor,Sports,Indoor,"Murphy, Lewis and Ramirez",Role everything unit concern.,396.35,191.15,334,43,34,0,2022-06-08,2026-01-14 21:34:03.605175
701,Building Indoor,Sports,Indoor,Delgado-Parker,Us join become size seek. Fact anyone think.,854.8,459.63,363,40,29,0,2024-05-10,2026-01-16 07:36:08.076647
702,Think Men,Clothing,Men,"Lewis, Aguilar and White",Produce picture bar.,139.3,72.65,11,93,13,0,2023-02-12,2026-01-14 08:06:38.023533
703,Red Phones,Electronics,Phones,Lewis Ltd,Better character line scene tonight main.,315.35,214.52,389,42,67,0,2022-04-13,2026-01-14 08:55:26.399721
704,Garden Furniture,Home,Furniture,Black-Scott,Dog down especially.,172.63,110.15,337,29,78,0,2024-01-29,2026-01-17 05:25:04.980400
705,Process Accessories,Electronics,Accessories,Gray-Ramirez,Great lawyer gas science soldier hair behavior.,497.69,244.22,441,30,43,0,2024-11-18,2026-01-05 01:29:34.852525
706,Strong Furniture,Home,Furniture,Williams-Johnson,Water involve land small.,606.79,448.87,474,76,42,1,2024-06-15,2026-01-01 01:31:22.281667
707,Hundred Phones,Electronics,Phones,Abbott Ltd,Miss much least central TV.,416.43,277.8,15,20,92,1,2024-02-12,2026-01-06 18:38:14.574434
708,Local Furniture,Home,Furniture,Jones Ltd,Care leg old natural foreign seem exist.,159.25,110.65,396,75,81,0,2024-02-28,2026-01-11 01:00:18.071191
709,Because Women,Clothing,Women,Downs-Mullins,Hard focus attorney yourself list.,391.25,227.45,104,29,54,0,2022-12-29,2026-01-15 02:33:16.688537
710,From Indoor,Sports,Indoor,Brown-Gibbs,Growth matter somebody car very paper.,909.37,464.65,14,76,1,0,2023-02-13,2026-01-17 11:02:42.846483
711,Game Furniture,Home,Furniture,White Inc,Assume bring hard.,247.85,122.83,171,98,41,0,2023-12-10,2026-01-18 09:19:58.035454
712,Sing Furniture,Home,Furniture,"Lee, Bishop and Hughes",Few unit once sport write their.,436.21,316.94,421,24,82,1,2025-01-01,2026-01-15 01:11:01.582565
713,Why Decor,Home,Decor,Shepard-Williams,Night measure participant public.,66.51,31.55,138,22,87,1,2022-05-31,2026-01-18 03:36:07.774718
714,Box Indoor,Sports,Indoor,Turner-Watts,Myself traditional stage player.,430.81,255.64,215,37,48,0,2023-03-24,2026-01-17 10:56:10.116909
715,Realize Outdoor,Sports,Outdoor,Holt PLC,Fall over machine image trial do health minute.,15.8,11.83,361,71,25,0,2022-04-13,2026-01-11 22:18:07.424666
716,Certainly Indoor,Sports,Indoor,Scott PLC,Identify consider these begin argue it.,925.6,473.2,144,93,58,0,2024-06-27,2026-01-15 19:09:00.162238
717,Success Decor,Home,Decor,"Cabrera, Tucker and Hooper",Sure type people good politics mother add.,448.52,245.42,53,86,28,1,2022-09-24,2026-01-01 17:53:35.354404
718,Network Decor,Home,Decor,Garcia-Martinez,Yard ago poor these another.,606.41,395.85,467,84,55,0,2024-03-27,2026-01-10 23:57:16.905417
719,Artist Kitchen,Home,Kitchen,Gomez Ltd,Bit work director situation.,18.69,12.03,359,46,19,1,2023-12-22,2026-01-19 10:25:17.184800
720,Including Indoor,Sports,Indoor,Stewart and Sons,Toward small mean.,159.11,112.16,113,95,33,1,2024-09-14,2026-01-21 02:43:12.036877
721,Matter Phones,Electronics,Phones,"Knapp, Brennan and Turner",Per sell institution stop deep discover.,106.92,54.92,299,88,84,0,2022-02-03,2026-01-18 16:46:22.407706
722,He Laptops,Electronics,Laptops,Wilkerson Ltd,Without fall expert.,559.69,309.88,173,49,33,0,2024-04-27,2026-01-16 04:08:58.245312
723,City Accessories,Electronics,Accessories,Austin LLC,First know officer.,79.06,41.25,223,40,18,0,2022-12-04,2026-01-11 05:36:54.121559
724,Produce Kitchen,Home,Kitchen,"Campbell, Strong and Lowery",Magazine point forward.,313.92,153.58,475,40,44,1,2023-04-03,2026-01-16 00:53:32.104484
725,Range Fitness,Sports,Fitness,"Bradford, Kelly and Bender",Tough question hard pressure.,443.46,254.49,433,85,100,0,2024-05-03,2026-01-02 10:50:02.980776
726,Strategy Men,Clothing,Men,Roberts-Mendez,Play present will station.,428.09,227.87,332,81,8,0,2024-09-20,2026-01-04 13:48:04.333435
727,Compare Furniture,Home,Furniture,Burns Inc,Community bed east rest talk set fire.,264.91,197.03,357,29,94,0,2024-02-05,2026-01-12 02:42:47.701564
728,Walk Decor,Home,Decor,Carlson-Martin,Lawyer well not this build southern mention what.,536.42,323.0,239,93,77,0,2023-09-12,2026-01-11 00:47:31.317645
729,Friend Outdoor,Sports,Outdoor,"Davis, Clark and Price",Senior take player suddenly foot base.,601.42,377.75,219,76,80,0,2022-03-19,2026-01-15 05:31:43.246482
730,Involve Outdoor,Sports,Outdoor,Cook Group,Itself stay out ever sound policy.,790.72,442.38,497,20,80,1,2022-08-06,2026-01-01 14:51:19.917383
731,Member Men,Clothing,Men,"Todd, Sandoval and Williams",Democratic miss floor.,282.2,200.51,429,89,8,0,2024-10-25,2026-01-08 04:18:28.890223
732,Condition Outdoor,Sports,Outdoor,Mitchell-Mcdonald,Write throughout perhaps guess agree.,276.98,195.17,50,73,42,0,2023-09-09,2026-01-01 17:27:36.887723
733,Send Decor,Home,Decor,Davila LLC,State see since close seven.,399.58,227.56,486,55,43,1,2024-06-21,2026-01-20 22:53:32.866711
734,View Indoor,Sports,Indoor,"Patterson, Ross and Hendrix",Fire foot section rise growth clear.,331.62,167.25,454,83,46,0,2023-07-05,2026-01-12 20:17:06.495069
735,Through Women,Clothing,Women,"Galvan, Gates and Baker",Event even skill fight what pull.,367.88,237.78,3,26,50,1,2022-07-23,2026-01-08 22:13:02.004265
736,Trade Decor,Home,Decor,"French, Smith and Murphy",Dark side education however enjoy.,660.19,394.51,271,36,38,0,2024-10-15,2026-01-06 11:10:32.899640
737,Side Furniture,Home,Furniture,Smith-Terry,Appear religious article else like.,340.17,210.29,166,33,20,0,2024-09-15,2026-01-05 15:29:43.750318
738,Actually Kitchen,Home,Kitchen,Weber Group,Four grow early certainly social more thought.,266.46,133.71,301,98,61,0,2024-01-11,2026-01-12 01:32:45.198220
739,Responsibility Phones,Electronics,Phones,"Martinez, Flores and Brown",Look meet summer window few law hard.,823.7,401.83,103,87,53,1,2022-08-07,2026-01-14 10:48:18.729291
740,Concern Accessories,Electronics,Accessories,Cook LLC,Stage cause bag others throughout.,798.33,388.89,420,80,6,0,2022-04-01,2026-01-12 11:50:57.349753
741,Peace Outdoor,Sports,Outdoor,Jones LLC,Particularly scientist TV sign around third.,799.3,479.37,23,99,39,0,2024-11-01,2026-01-04 04:28:59.764428
742,Three Men,Clothing,Men,Franklin Ltd,Then fast newspaper stage herself him.,432.19,258.78,88,25,89,0,2023-05-23,2026-01-08 04:01:57.590938
743,Child Accessories,Electronics,Accessories,Davidson-Brown,Fear door some occur situation record risk.,548.02,307.67,15,97,100,0,2023-12-18,2026-01-18 18:39:45.380893
744,Arm Phones,Electronics,Phones,Hunt-Knight,Kind clearly let rich.,251.62,138.21,298,75,82,0,2022-12-27,2026-01-21 02:50:17.176330
745,Fly Fitness,Sports,Fitness,Douglas-Patel,National she spend wife study.,504.68,244.97,420,93,63,0,2023-05-29,2026-01-11 03:46:25.644497
746,Threat Kitchen,Home,Kitchen,Carr-Collins,Land kid wish letter evidence. Red this lead too.,890.98,495.07,56,46,47,1,2023-11-20,2026-01-15 13:23:43.406823
747,Lot Decor,Home,Decor,Young PLC,Hot clear mention identify sound government.,18.29,11.53,21,79,27,0,2024-03-13,2026-01-17 05:24:36.148116
748,Former Fitness,Sports,Fitness,Tate PLC,Rest wind bar standard.,544.23,248.61,498,21,74,0,2022-04-29,2026-01-15 13:35:57.825434
749,Such Fitness,Sports,Fitness,Turner Ltd,Investment off poor level any attention mention.,482.23,321.38,128,22,44,0,2023-11-11,2026-01-04 03:32:29.794672
750,Tend Kids,Clothing,Kids,Roach LLC,Hair cover notice movement there trade son.,639.28,491.38,367,98,33,0,2024-08-30,2026-01-11 04:03:48.070866
751,More Kids,Clothing,Kids,"Campbell, Hunter and Gonzalez",Financial instead move bed total.,904.18,436.6,410,49,12,0,2022-09-11,2026-01-02 21:03:03.321305
752,Arrive Women,Clothing,Women,Smith and Sons,Administration official traditional probably.,485.84,262.69,445,22,60,0,2023-01-20,2026-01-08 06:58:22.482131
753,Phone Furniture,Home,Furniture,Swanson Ltd,Cut mission value son sign imagine blue me.,34.99,25.23,380,76,86,1,2024-06-20,2026-01-19 16:59:57.179063
754,Candidate Indoor,Sports,Indoor,Reynolds-Solis,Property religious clear maintain.,460.5,268.63,312,66,15,0,2023-04-30,2026-01-12 01:17:28.024457
755,Save Accessories,Electronics,Accessories,"Patrick, Hart and Singh",Firm within somebody free.,884.17,450.18,465,86,93,0,2022-03-14,2026-01-07 14:45:30.072125
756,Population Men,Clothing,Men,Bell PLC,Use until growth skill.,500.59,252.93,66,97,41,1,2024-07-28,2026-01-02 19:53:52.075619
757,Activity Furniture,Home,Furniture,"Stewart, Rasmussen and Oneal",Bar particular try unit still three.,414.82,287.42,331,48,22,1,2023-11-09,2026-01-16 19:39:33.027655
758,Return Accessories,Electronics,Accessories,Montoya-Jenkins,Develop close sure trip tend city either.,630.34,323.2,192,99,97,0,2024-09-18,2026-01-05 18:14:37.178874
759,Institution Women,Clothing,Women,Garcia-Anderson,It rise source cold.,368.85,212.9,475,86,27,0,2025-01-17,2026-01-05 09:41:08.899082
760,Pretty Outdoor,Sports,Outdoor,Robbins-Ramirez,Movement likely guy describe own.,578.25,351.4,93,95,28,0,2022-07-06,2026-01-19 15:57:33.144159
761,Big Furniture,Home,Furniture,"Lewis, Byrd and Bailey",Maybe Democrat partner door major hold various.,872.26,490.95,457,31,60,0,2024-10-16,2026-01-13 10:37:54.370348
762,Science Furniture,Home,Furniture,Lang-Griffin,Able apply door name.,905.69,443.75,420,63,73,0,2022-11-06,2026-01-20 07:40:04.949287
763,Could Fitness,Sports,Fitness,Morgan PLC,Worker authority everything whom involve former.,567.77,276.64,477,73,20,0,2023-11-03,2026-01-17 20:28:21.169304
764,Around Women,Clothing,Women,"Anderson, Suarez and Hernandez",Green traditional recent.,545.05,363.84,242,35,58,0,2023-08-30,2026-01-06 02:39:11.745816
765,Identify Men,Clothing,Men,Wagner-Roberson,Stuff person deal find.,225.28,117.86,293,27,5,1,2024-03-07,2026-01-02 06:06:24.300407
766,Deep Kitchen,Home,Kitchen,Johnson LLC,Activity room eat article central.,849.29,437.1,321,77,8,0,2024-06-24,2026-01-13 21:42:15.546324
767,Stage Indoor,Sports,Indoor,Moore LLC,Start truth quickly small.,565.5,292.56,36,100,57,1,2023-05-02,2026-01-19 20:28:28.205835
768,Nor Indoor,Sports,Indoor,"Johnson, Thomas and Duncan",Rule space son increase type name.,294.12,160.37,39,89,70,0,2023-08-22,2026-01-07 23:43:29.589320
769,View Fitness,Sports,Fitness,Henderson Inc,Fall energy resource relationship while director.,192.16,109.01,180,94,9,0,2023-02-19,2026-01-01 16:37:33.400734
770,Account Fitness,Sports,Fitness,Bautista-Jones,Region need nor city ability common.,61.52,33.75,189,85,78,1,2022-05-20,2026-01-01 23:46:00.360258
771,Shake Women,Clothing,Women,Gutierrez and Sons,Begin continue bag popular represent item.,616.85,414.25,134,90,66,1,2024-08-27,2026-01-06 07:46:41.068505
772,Who Outdoor,Sports,Outdoor,Williams Ltd,Service truth around. Movie tend wish worker.,549.78,264.94,491,22,88,1,2023-11-28,2026-01-18 05:23:25.504197
773,Simple Outdoor,Sports,Outdoor,"Mckenzie, West and Hickman",Buy hope old stage.,146.21,79.71,348,33,24,0,2023-01-24,2026-01-16 10:02:54.640343
774,Important Accessories,Electronics,Accessories,"Delgado, Oliver and Wright",Go ok capital camera. Kid major scene amount son.,836.07,425.61,280,89,13,0,2024-01-11,2026-01-09 20:09:10.773669
775,Play Fitness,Sports,Fitness,Boyd-Hooper,Red throw nice impact moment.,545.87,393.15,392,37,4,1,2024-04-02,2026-01-17 04:38:41.736126
776,Season Laptops,Electronics,Laptops,"Goodwin, Hall and Jarvis",Subject part maintain other.,391.06,197.07,494,96,5,0,2024-08-25,2026-01-04 11:32:48.083505
777,He Laptops,Electronics,Laptops,"Salas, Armstrong and Day",Account system clear happen approach.,441.97,295.14,399,38,76,0,2024-05-31,2026-01-10 07:30:40.218702
778,Yet Fitness,Sports,Fitness,Martin LLC,Middle agent enjoy quite fall whole.,460.37,305.31,140,85,85,1,2022-10-04,2026-01-11 11:14:17.143731
779,Lead Decor,Home,Decor,"Jones, Robbins and Matthews",Class account several teacher any including.,961.43,451.55,124,60,6,1,2024-05-16,2026-01-04 20:55:00.771302
780,Fear Indoor,Sports,Indoor,"King, Hunt and King",Strategy leave they. Day everybody thousand.,431.36,232.82,441,86,94,0,2022-02-16,2026-01-10 16:25:41.140692
781,Police Women,Clothing,Women,Aguirre-Massey,Physical suddenly subject cost economy.,306.93,180.39,409,82,57,0,2024-03-02,2026-01-13 06:18:55.663477
782,Economy Phones,Electronics,Phones,Orozco-Carlson,Finally everything job film.,796.18,420.73,450,47,13,0,2023-05-19,2026-01-06 20:12:04.476276
783,Leader Kitchen,Home,Kitchen,Burton-Johnson,Save main physical scientist receive raise.,608.21,317.9,393,60,57,0,2024-06-05,2026-01-19 11:15:08.829407
784,Wide Furniture,Home,Furniture,"May, Black and Lucero",Somebody could present any.,573.59,323.64,316,97,87,0,2024-05-25,2026-01-05 11:54:35.092386
785,Learn Decor,Home,Decor,Young-Santos,Action range left theory page policy.,633.23,411.97,159,67,66,0,2022-10-29,2026-01-07 11:34:30.943639
786,Environmental Phones,Electronics,Phones,"Mcpherson, Mcgee and Miller",Heart me line large. Democrat around game.,251.05,159.12,247,26,84,0,2023-02-05,2026-01-18 23:18:44.909351
787,According Men,Clothing,Men,Johnson-Young,Person central attention health might.,984.82,489.0,435,26,26,1,2024-08-25,2026-01-10 21:23:50.584959
788,Coach Outdoor,Sports,Outdoor,Lopez-Thomas,House light institution if argue.,326.93,165.53,419,88,78,0,2023-08-05,2026-01-01 15:00:32.689981
789,West Accessories,Electronics,Accessories,Jackson Inc,Ball now protect model whatever.,671.55,321.24,230,99,58,0,2022-12-07,2026-01-19 02:47:20.993947
790,Sit Men,Clothing,Men,"Jackson, Patterson and Clark",Forget painting let type appear start.,505.04,321.21,398,100,35,0,2022-06-04,2026-01-01 13:06:01.598800
791,Three Fitness,Sports,Fitness,Combs-Dougherty,South nature kind last class right.,249.79,149.5,242,93,38,0,2024-07-24,2026-01-03 18:16:05.263459
792,Seat Women,Clothing,Women,"Rice, Romero and Palmer",Power word west very news.,613.49,364.19,152,22,9,1,2023-10-21,2026-01-14 14:18:27.321120
793,Better Men,Clothing,Men,"Guerrero, Jones and Meyers",Produce young one buy part network.,534.27,308.51,388,83,65,0,2022-04-03,2026-01-09 16:28:36.751415
794,Time Laptops,Electronics,Laptops,Robles-Sims,Worker national thus ok far meeting.,512.68,293.23,231,40,77,0,2022-05-27,2026-01-09 23:49:49.826064
795,Pull Outdoor,Sports,Outdoor,"Alvarado, Hernandez and Craig",Continue method kitchen dream.,93.81,56.71,286,46,91,0,2024-10-19,2026-01-05 23:50:18.918946
796,Look Kids,Clothing,Kids,Cruz PLC,On relationship low probably.,664.53,415.78,188,58,83,0,2024-02-02,2026-01-02 09:16:39.983628
797,Every Men,Clothing,Men,"Haas, Fisher and Parsons",Play say deep challenge out allow.,126.61,91.65,437,67,9,0,2023-10-07,2026-01-21 15:50:08.297983
798,Parent Decor,Home,Decor,Poole LLC,Report find then according effort many prevent.,215.39,127.48,199,23,60,0,2022-12-31,2026-01-04 20:11:08.927881
799,Arrive Kitchen,Home,Kitchen,Flores-Murray,Mouth voice place oil each strong.,821.42,398.38,363,52,50,0,2024-12-22,2026-01-21 00:06:09.393348
800,Peace Laptops,Electronics,Laptops,Rose-Miller,Risk play message learn while former science.,676.64,372.79,278,56,84,0,2023-08-26,2026-01-10 11:38:07.638406
801,Social Indoor,Sports,Indoor,"Miller, Ferguson and Simmons",Establish final project threat no.,792.01,371.66,312,34,55,0,2024-08-13,2026-01-04 10:19:03.928397
802,Guess Outdoor,Sports,Outdoor,Smith-Stevens,Democrat identify similar commercial.,369.64,171.65,459,41,10,0,2022-10-11,2026-01-05 23:34:31.190004
803,See Fitness,Sports,Fitness,"Berg, Hill and Peters",Floor machine enough character expect.,523.19,278.15,482,56,13,0,2023-01-30,2026-01-07 16:03:27.533807
804,Else Kitchen,Home,Kitchen,Schroeder PLC,Safe film Democrat room owner paper.,552.85,335.48,455,27,91,0,2023-12-27,2026-01-17 06:49:48.696732
805,Type Kids,Clothing,Kids,Jones-Cruz,President send research accept ever.,419.36,245.99,13,36,76,0,2022-12-24,2026-01-03 18:38:56.982236
806,Fly Indoor,Sports,Indoor,Copeland Ltd,Thank sort summer smile fly ability work.,733.65,333.9,497,45,99,0,2022-07-15,2026-01-14 05:33:39.803984
807,Night Women,Clothing,Women,Wiggins Group,Ability list no particular role general.,900.05,481.06,496,23,74,1,2023-03-09,2026-01-16 07:50:34.511686
808,Market Men,Clothing,Men,Marsh-Myers,Coach put as whole individual.,413.19,281.13,193,77,59,0,2024-09-23,2026-01-07 00:31:36.989442
809,Five Indoor,Sports,Indoor,Leach Group,Detail strategy prepare against carry.,452.73,209.86,0,37,41,1,2022-08-04,2026-01-09 06:00:24.024154
810,Ever Women,Clothing,Women,"Haynes, Martinez and Mann",Yourself study wide level around chair son north.,196.29,91.08,16,37,17,0,2024-09-18,2026-01-03 22:29:30.849783
811,Scientist Women,Clothing,Women,Weber-Schmidt,Health relate fight he.,552.67,308.79,37,46,93,1,2023-07-19,2026-01-06 00:13:50.595984
812,Need Fitness,Sports,Fitness,Mcdonald and Sons,Value church program understand budget pull.,191.81,114.25,183,99,95,0,2024-02-06,2026-01-20 07:10:38.354315
813,Item Laptops,Electronics,Laptops,"Carter, Swanson and Gonzalez",Various under officer so.,801.91,432.8,167,39,82,0,2024-04-21,2026-01-15 17:23:18.736963
814,Need Kitchen,Home,Kitchen,Clark PLC,People edge same his herself over rich.,100.98,64.55,315,41,28,0,2022-08-15,2026-01-08 10:00:50.025252
815,Mention Furniture,Home,Furniture,Edwards Ltd,Actually describe interest go radio away them.,478.7,231.67,464,66,56,0,2022-04-12,2026-01-16 01:29:14.415880
816,Stage Women,Clothing,Women,Ramirez and Sons,Risk analysis back indeed season support.,570.4,407.71,196,51,63,0,2022-09-01,2026-01-02 13:18:44.721207
817,Nothing Outdoor,Sports,Outdoor,Hensley and Sons,Up full seven voice car. Participant radio sell.,69.23,37.91,384,65,95,1,2022-03-31,2026-01-13 12:18:29.610524
818,Yourself Kitchen,Home,Kitchen,Snyder LLC,Study turn laugh big public.,423.14,293.41,93,82,88,1,2024-02-17,2026-01-09 11:28:22.283897
819,Film Indoor,Sports,Indoor,"Brown, Banks and Torres",Hope low century. Production he wear continue.,638.32,406.89,23,23,28,0,2024-01-23,2026-01-12 12:16:45.283016
820,Environmental Phones,Electronics,Phones,Smith Group,Great few turn here travel own.,596.81,372.76,32,46,35,0,2024-10-10,2026-01-03 21:52:30.089376
821,Save Decor,Home,Decor,"Harper, Williams and Rodriguez",Reach group few consumer body budget language.,289.13,202.67,273,88,30,0,2024-02-17,2026-01-09 15:18:15.184319
822,Account Kitchen,Home,Kitchen,Jones-Brock,From partner might run.,818.47,378.74,33,52,47,0,2022-05-26,2026-01-09 01:54:31.406645
823,Push Fitness,Sports,Fitness,Vang-Day,Score head just create stage.,509.93,370.77,351,81,38,0,2024-07-05,2026-01-05 14:00:12.303198
824,Rise Women,Clothing,Women,"Meyer, Carter and Velazquez",Story I catch whom chance.,78.16,50.93,400,95,59,1,2022-03-07,2026-01-17 04:31:40.117396
825,Explain Furniture,Home,Furniture,Schmidt Ltd,Attorney will sort able.,76.08,36.45,4,57,2,0,2023-01-28,2026-01-07 04:07:48.161920
826,Sell Furniture,Home,Furniture,Gaines-Watkins,Hair stay station.,420.86,223.2,217,32,66,0,2023-02-05,2026-01-20 19:17:59.456745
827,While Accessories,Electronics,Accessories,"Moore, Smith and Christensen",Fund education list expect.,436.2,266.53,26,27,13,1,2024-10-14,2026-01-06 01:54:28.145077
828,Expect Men,Clothing,Men,"Mercer, Maddox and Lee",Top develop team activity.,290.85,159.45,166,31,9,0,2024-05-29,2026-01-21 17:37:38.219887
829,Believe Women,Clothing,Women,Baker Group,Trouble almost throw challenge trial rule ahead.,406.59,243.28,323,33,2,1,2024-10-01,2026-01-12 23:16:11.888070
830,Take Accessories,Electronics,Accessories,"Cervantes, Mitchell and Woods",Artist many follow way.,309.42,230.77,343,71,81,0,2023-12-25,2026-01-06 14:59:15.338324
831,Clearly Indoor,Sports,Indoor,"Schneider, Scott and Jones",Suffer about method guy conference.,136.54,68.79,429,26,53,0,2024-04-07,2026-01-08 16:06:02.556200
832,Boy Women,Clothing,Women,"Solis, Gonzalez and Greene",Opportunity story leader show sea third.,778.8,411.87,125,29,48,0,2022-06-15,2026-01-18 10:12:21.987884
833,Budget Kids,Clothing,Kids,Lloyd Group,Stock government everyone once item difficult.,488.76,372.81,17,26,24,0,2022-12-17,2026-01-10 22:54:24.691323
834,Including Phones,Electronics,Phones,Reed-Price,Organization keep page page east.,809.95,479.67,171,62,90,0,2024-12-28,2026-01-17 00:27:06.336230
835,Law Furniture,Home,Furniture,Fischer-Livingston,Fill over that. Deep whom apply mention.,173.59,88.26,49,57,20,0,2024-07-18,2026-01-06 16:21:09.219292
836,Responsibility Indoor,Sports,Indoor,"Hernandez, Cook and Wilson",Guy so leader see physical.,338.17,242.8,38,52,41,0,2022-08-13,2026-01-04 14:44:26.519399
837,Ahead Phones,Electronics,Phones,Garcia-Schroeder,Whom third reality claim memory catch.,816.92,491.64,457,51,27,0,2024-08-11,2026-01-20 18:06:16.955770
838,Kitchen Men,Clothing,Men,"Wright, Krueger and Fritz",We know affect catch even. Full visit right.,662.17,427.18,16,60,30,0,2025-01-01,2026-01-16 23:36:55.633696
839,Hot Kids,Clothing,Kids,Jennings and Sons,Open statement receive word give want matter.,150.72,92.17,71,23,13,0,2025-01-09,2026-01-20 11:27:59.090959
840,Thus Phones,Electronics,Phones,Wood LLC,Certainly its act teach can.,582.0,380.29,157,46,29,0,2024-01-06,2026-01-11 21:36:40.313350
841,Site Men,Clothing,Men,Jordan-Morgan,Soldier full air low.,525.05,322.66,264,68,15,0,2024-01-22,2026-01-09 19:33:19.318446
842,Painting Men,Clothing,Men,"Williams, Moore and Reyes",Night phone miss source trial.,562.27,367.8,426,72,87,0,2024-07-05,2026-01-07 06:07:04.864154
843,Food Furniture,Home,Furniture,Gates-Willis,Program consider professional.,164.62,112.21,204,58,99,0,2024-08-22,2026-01-07 08:27:00.206107
844,On Indoor,Sports,Indoor,Velasquez-Brandt,Marriage choice never.,578.82,397.56,298,85,56,1,2024-09-15,2026-01-05 11:09:14.260175
845,Thus Women,Clothing,Women,"Johnson, Sanders and Lawson",Use more impact do stuff performance wife.,122.85,91.06,414,94,46,0,2023-02-24,2026-01-11 14:56:14.949346
846,I Indoor,Sports,Indoor,"Pittman, Perez and Barber",Despite building writer rather.,552.64,320.15,463,51,36,0,2023-08-26,2026-01-11 15:24:21.675856
847,From Kids,Clothing,Kids,Rich-Mitchell,Free book local body former onto.,360.0,238.59,207,31,43,0,2023-05-22,2026-01-12 03:45:09.581343
848,Avoid Indoor,Sports,Indoor,"Serrano, Grant and Brown",Thing large environment ball hand good tree.,301.64,188.61,433,28,35,1,2023-05-20,2026-01-15 22:42:03.429165
849,Hair Outdoor,Sports,Outdoor,Stokes-Scott,Cause use put include. Including guy admit.,286.1,188.02,327,85,8,1,2023-10-22,2026-01-18 07:05:42.640398
850,Like Indoor,Sports,Indoor,Edwards and Sons,Herself girl rich operation scientist report set.,98.51,57.09,189,48,32,1,2023-04-28,2026-01-11 08:15:19.319082
851,Score Furniture,Home,Furniture,"Perez, Dorsey and Brooks",Door still ok push game this simply happy.,250.92,147.83,485,54,98,1,2024-07-04,2026-01-01 10:27:35.049141
852,Within Fitness,Sports,Fitness,"Simmons, Cuevas and Koch",Pay leave home meet.,245.07,162.3,106,91,75,1,2022-12-08,2026-01-01 04:17:08.979638
