product_id,product_name,category,sub_category,brand,description,price,cost,stock_quantity,reorder_level,supplier_id,is_discontinued,created_date,last_updated
1700,Speak Laptops,Electronics,Laptops,Reyes-Daniel,Happy win prove idea price table.,201.02,116.04,81,42,54,0,2022-09-04,2026-01-21 05:02:58.908704
1701,Party Accessories,Electronics,Accessories,Gentry-Howard,Culture alone style know.,96.33,67.33,119,79,57,0,2024-03-21,2026-01-13 07:52:54.699091
1702,Increase Women,Clothing,Women,Fisher-Johnson,Meeting paper serve condition cup.,619.03,390.8,317,91,42,1,2022-02-03,2026-01-05 02:05:54.757099
1703,Area Outdoor,Sports,Outdoor,Gutierrez-Malone,Garden policy society else organization.,954.26,445.88,31,71,25,0,2023-03-19,2026-01-06 20:57:03.036620
1704,Oil Kids,Clothing,Kids,"Farrell, Walker and Acosta",What decade heavy oil activity real.,679.41,331.82,382,23,11,0,2023-07-09,2026-01-19 03:46:04.649672
1705,Ball Fitness,Sports,Fitness,Jefferson-Moore,Board growth theory rest same.,588.95,278.94,132,73,91,1,2022-03-16,2026-01-12 18:43:00.147829
1706,Able Decor,Home,Decor,"Skinner, Jones and Potts",Heavy order right sign leave successful.,415.55,291.9,451,54,63,1,2023-12-01,2026-01-14 08:00:30.482525
1707,Attorney Accessories,Electronics,Accessories,Griffin-Mcmahon,Lead member entire require mean some.,406.58,211.39,9,74,34,1,2023-10-09,2026-01-10 03:07:17.714791
1708,Talk Kids,Clothing,Kids,Estrada LLC,Summer control impact season.,670.86,315.68,175,42,47,1,2023-03-22,2026-01-17 17:33:28.075279
1709,Year Women,Clothing,Women,Sullivan LLC,Republican this live capital scene.,533.93,277.31,240,83,71,0,2024-12-05,2026-01-03 11:05:36.017656
1710,Buy Laptops,Electronics,Laptops,Phillips-Martinez,Impact also response positive attack or light.,13.07,6.78,310,54,54,0,2023-07-11,2026-01-04 02:39:38.219757
1711,Would Indoor,Sports,Indoor,Gibson Inc,Discuss from language hospital just.,482.28,231.78,222,31,19,1,2023-03-15,2026-01-04 15:41:07.985875
1712,Road Kids,Clothing,Kids,Forbes-Campbell,Special note blue blood me.,259.85,156.63,31,96,18,0,2023-02-01,2026-01-21 05:49:19.598308
1713,Top Fitness,Sports,Fitness,Glenn-Hall,Other scientist four explain. Task well may add.,699.5,361.18,387,68,33,0,2024-08-07,2026-01-20 00:49:15.793115
1714,Show Outdoor,Sports,Outdoor,Warren-Myers,Guy detail movie attack coach job religious.,8.34,5.65,252,29,83,1,2024-07-27,2026-01-17 12:18:31.162385
1715,Save Laptops,Electronics,Laptops,"Martinez, Pena and Johnson",Argue dinner region consider buy write coach.,382.6,196.66,277,85,2,0,2022-07-20,2026-01-09 14:26:54.162185
1716,Eight Accessories,Electronics,Accessories,Brown-King,Realize teach without do minute.,789.28,420.47,193,59,61,0,2024-02-22,2026-01-10 17:31:59.485756
1717,Use Phones,Electronics,Phones,Lewis-Gilbert,Though successful particularly.,417.63,235.77,459,35,23,0,2023-05-07,2026-01-02 01:50:14.676991
1718,Well Kids,Clothing,Kids,Tapia-Sanders,Camera blood sister physical government into.,520.85,343.93,191,54,11,1,2022-07-20,2026-01-07 01:39:53.183420
1719,Leg Phones,Electronics,Phones,"Garcia, Tanner and Zamora",Western religious wish material.,400.06,290.52,315,91,88,0,2022-11-13,2026-01-18 19:21:00.017965
1720,Mr Accessories,Electronics,Accessories,Ramsey Ltd,Soldier hundred not hour.,476.32,222.8,60,80,1,1,2024-12-04,2026-01-16 16:23:07.616992
1721,Produce Outdoor,Sports,Outdoor,Herrera LLC,Sign professional top successful job act offer.,249.29,186.67,239,33,93,0,2022-09-26,2026-01-06 11:53:28.794000
1722,Accept Indoor,Sports,Indoor,Ramirez PLC,Ahead fast write piece stay already indicate.,50.85,33.82,217,90,75,0,2023-11-29,2026-01-04 19:30:04.116077
1723,Artist Fitness,Sports,Fitness,Wood-Shannon,Carry try prevent drop artist along.,371.92,192.76,331,57,53,0,2023-04-13,2026-01-11 21:00:41.224310
1724,Whom Laptops,Electronics,Laptops,Barrera-Medina,History phone final full hear more represent.,673.73,487.35,474,93,1,0,2022-06-26,2026-01-02 11:35:01.524992
1725,Institution Outdoor,Sports,Outdoor,Montgomery and Sons,Improve final term entire shake deep age.,713.61,408.54,377,66,4,0,2023-01-21,2026-01-20 16:45:36.772489
1726,Name Laptops,Electronics,Laptops,Stein PLC,Last suffer bar thousand.,46.44,28.79,147,92,61,0,2022-07-21,2026-01-14 19:54:46.368917
1727,Want Kids,Clothing,Kids,"Cook, Russell and Davis",Expect will force rock build these force.,500.01,342.93,41,21,87,0,2024-03-03,2026-01-11 18:19:33.857049
1728,Production Indoor,Sports,Indoor,Gutierrez-Barron,Season occur itself hotel.,910.63,452.71,242,54,83,1,2024-07-21,2026-01-01 21:34:06.900541
1729,Best Decor,Home,Decor,Howard PLC,Special price address often expert memory.,218.65,118.88,164,96,96,1,2024-09-28,2026-01-21 13:10:21.110573
1730,Use Kitchen,Home,Kitchen,"Brown, Prince and Spence",Book detail hand tonight.,604.12,416.55,77,69,85,0,2023-02-15,2026-01-08 20:11:59.528749
1731,Us Men,Clothing,Men,"Park, Bruce and Cooper",Opportunity yet artist society weight quality.,240.0,144.23,57,64,100,0,2022-02-06,2026-01-18 08:51:42.322819
1732,Their Indoor,Sports,Indoor,Macdonald-Carpenter,Room health player see.,49.3,24.48,348,66,12,0,2024-08-31,2026-01-20 14:12:07.595989
1733,Step Women,Clothing,Women,Hawkins Inc,Administration would stay wrong star try.,1024.82,469.03,392,49,57,1,2022-04-22,2026-01-08 06:29:33.517543
1734,Financial Fitness,Sports,Fitness,"Chan, White and Goodman",Relationship happen including even push brother.,579.15,288.85,311,77,49,0,2023-12-31,2026-01-01 00:19:55.962730
1735,Explain Outdoor,Sports,Outdoor,"Reed, Lynch and Lopez",Kid watch single and.,666.33,419.55,254,31,59,0,2024-05-15,2026-01-12 19:27:28.904023
1736,Role Laptops,Electronics,Laptops,Weaver-Young,Like event safe study mother.,487.34,262.88,200,86,66,0,2024-10-13,2026-01-13 18:25:09.587664
1737,Month Kitchen,Home,Kitchen,Sellers Ltd,Law laugh nothing leader board.,394.31,296.17,29,47,44,1,2022-04-01,2026-01-16 01:48:09.051570
1738,Happy Women,Clothing,Women,"Jackson, Thomas and Taylor",Cause easy rest leg.,702.64,368.56,227,52,34,0,2023-07-12,2026-01-02 06:53:56.384014
1739,Body Accessories,Electronics,Accessories,Walters-Baker,Keep value kind space yourself pay board.,559.57,310.52,107,43,34,0,2023-07-31,2026-01-14 14:38:42.820961
1740,Far Women,Clothing,Women,"Johnson, Blanchard and Crawford",Play hold maintain loss.,130.6,76.95,302,33,13,0,2022-12-31,2026-01-15 06:18:49.557287
1741,Where Accessories,Electronics,Accessories,"Byrd, Wong and West",Successful nation week energy born deep.,1020.92,481.58,265,67,89,0,2024-06-19,2026-01-14 08:00:24.426158
1742,Piece Kitchen,Home,Kitchen,Graham Ltd,Through white trip perhaps.,717.2,340.33,312,90,86,0,2023-12-08,2026-01-07 05:53:56.199354
1743,Daughter Men,Clothing,Men,Fox-Barnes,Study table line present.,69.41,42.81,295,72,16,0,2023-03-18,2026-01-07 13:51:19.994468
1744,Read Accessories,Electronics,Accessories,Moody-Larson,Quickly improve sense cell hospital series.,442.19,229.71,333,55,89,0,2024-02-07,2026-01-06 08:06:58.567339
1745,Per Phones,Electronics,Phones,"Boyle, Ross and Walker",Simple major effect their time force example.,161.99,78.16,135,39,45,1,2022-11-09,2026-01-20 09:00:55.790081
1746,Table Men,Clothing,Men,"Smith, Fox and Mason",Draw customer peace research. Goal itself edge.,273.06,170.8,279,40,74,1,2022-12-13,2026-01-15 01:16:09.595194
1747,Strong Accessories,Electronics,Accessories,Hawkins-Moore,Apply guess away Congress cell name.,666.3,306.83,437,56,61,0,2022-05-17,2026-01-04 12:58:12.781009
1748,Republican Kitchen,Home,Kitchen,Aguilar-Brown,Piece anyone option purpose.,203.49,156.0,89,94,32,1,2023-02-11,2026-01-19 18:22:24.424901
1749,Can Laptops,Electronics,Laptops,"Carey, Walters and Blanchard",Behind point world evening.,769.79,361.92,349,80,24,0,2024-07-12,2026-01-18 01:47:10.381745
1750,Action Kitchen,Home,Kitchen,"Flowers, Green and Collier",State be plant.,64.26,43.87,172,88,7,0,2022-08-08,2026-01-05 21:44:17.890330
1751,Rate Furniture,Home,Furniture,Schultz Group,Court over scene suddenly may.,658.84,312.64,216,77,55,1,2023-08-12,2026-01-09 16:22:05.355772
1752,Kid Indoor,Sports,Indoor,Robinson-Mitchell,Enough laugh easy water.,261.59,168.67,262,53,58,0,2024-12-02,2026-01-18 09:37:16.750780
1753,Treatment Phones,Electronics,Phones,"Atkinson, Goodman and Martin",Understand strong until return send second world.,199.97,142.43,312,37,93,0,2023-07-23,2026-01-19 21:12:16.007618
1754,Wonder Outdoor,Sports,Outdoor,Rivera-Vega,Development analysis its hour dog ball.,752.08,347.17,222,43,90,1,2022-10-22,2026-01-03 22:38:59.277446
1755,Scene Decor,Home,Decor,"Smith, Rodriguez and Nelson",Head another human keep. Campaign success alone.,1084.84,495.57,297,46,33,1,2024-08-22,2026-01-04 17:00:17.973103
1756,Radio Kids,Clothing,Kids,Perez and Sons,Old course identify. School old still short.,424.68,303.39,430,55,68,0,2024-02-04,2026-01-07 07:30:02.896514
1757,Close Kitchen,Home,Kitchen,Meza-Santos,Age career issue.,510.64,304.0,403,64,53,0,2022-06-22,2026-01-01 20:24:27.097442
1758,Game Laptops,Electronics,Laptops,"Smith, Morgan and Hale",Career character summer outside easy pick bit.,420.28,207.75,69,36,90,0,2023-09-12,2026-01-21 01:03:42.791806
1759,Painting Laptops,Electronics,Laptops,"Fuentes, Butler and Bennett",Real together rest remember along expert.,31.81,18.97,314,52,67,0,2023-01-05,2026-01-01 02:29:00.655409
1760,Partner Furniture,Home,Furniture,Jones-Miranda,Might run risk become job him.,73.98,55.56,361,36,58,0,2022-08-23,2026-01-18 05:35:13.998802
1761,Most Men,Clothing,Men,Jackson-Perez,Tax gun medical remember before trial site.,63.98,31.16,491,42,84,1,2024-06-19,2026-01-08 12:34:08.858525
1762,Leg Accessories,Electronics,Accessories,"Maxwell, Graham and Brown",Carry pull happen occur. Growth fall really ever.,395.34,209.86,145,58,59,0,2024-08-26,2026-01-15 17:09:11.276741
1763,Effect Outdoor,Sports,Outdoor,Moyer Ltd,Before rich discussion western focus.,871.51,431.48,53,36,81,0,2022-10-05,2026-01-08 13:29:37.625628
1764,Sport Kids,Clothing,Kids,"Baker, Chang and Jones",View prove position industry.,611.18,350.77,433,43,72,1,2023-03-24,2026-01-14 09:43:57.262878
1765,Word Laptops,Electronics,Laptops,"Lopez, Ramirez and Jackson",High business past fire language.,334.9,211.02,451,58,45,0,2022-12-11,2026-01-17 20:35:12.388511
1766,Financial Indoor,Sports,Indoor,Hernandez-Cabrera,Capital table example subject move kind seek.,202.21,119.67,362,57,11,0,2024-09-23,2026-01-14 00:41:43.149427
1767,Perform Kids,Clothing,Kids,Valdez Group,Manage toward traditional benefit crime.,818.55,427.98,90,63,18,0,2023-05-11,2026-01-04 06:34:29.869307
1768,East Kids,Clothing,Kids,Gutierrez Inc,Perhaps remain to Mrs someone protect have.,471.65,264.04,221,94,6,0,2022-02-20,2026-01-13 22:17:39.505704
1769,Across Kitchen,Home,Kitchen,Mcgee Ltd,Evening happen war they they economic.,576.61,296.72,269,59,23,0,2024-08-09,2026-01-11 08:49:19.914163
1770,Hair Kitchen,Home,Kitchen,Dalton-Baker,Bad in could would mother star.,705.69,442.3,22,51,11,0,2023-05-11,2026-01-01 08:04:54.180790
1771,Month Kids,Clothing,Kids,Brewer-Martin,Any world town lay offer say.,566.89,272.5,235,31,94,0,2024-04-21,2026-01-20 10:03:05.490430
1772,Series Kids,Clothing,Kids,"Wiley, King and Quinn",Present down fish action majority.,110.3,83.87,444,75,49,1,2023-09-23,2026-01-18 15:02:28.615947
1773,Local Furniture,Home,Furniture,Olson-Miller,Friend like organization argue.,843.69,394.89,383,81,70,1,2023-01-27,2026-01-21 00:16:07.593037
1774,Administration Women,Clothing,Women,Taylor-Hughes,Probably large them unit.,913.25,472.65,398,63,24,1,2023-12-31,2026-01-12 20:20:19.604690
1775,Seem Kids,Clothing,Kids,"Carter, Wood and Harvey",Than fact rock brother light policy.,384.07,234.07,14,51,20,0,2023-08-15,2026-01-02 04:40:03.953172
1776,Alone Indoor,Sports,Indoor,Smith LLC,Concern whether middle turn say.,579.0,282.71,224,30,96,0,2024-02-18,2026-01-16 23:18:50.512567
1777,Bit Outdoor,Sports,Outdoor,Lopez-Campbell,Money especially star.,503.49,334.59,113,54,82,0,2022-11-13,2026-01-08 06:10:44.135676
1778,Hair Kitchen,Home,Kitchen,"Ford, Jones and Andrews",Amount son them such Mr people during feeling.,263.02,125.15,88,44,84,0,2024-02-17,2026-01-01 01:27:29.206837
1779,Center Indoor,Sports,Indoor,"Brewer, Barrera and Baker",System why reduce necessary station series eight.,644.77,323.94,28,52,43,0,2022-08-14,2026-01-06 12:13:06.876828
1780,Even Decor,Home,Decor,Moore-Gonzalez,Risk man couple after almost in.,331.24,181.44,111,27,17,1,2023-01-13,2026-01-05 05:22:12.055036
1781,Increase Kids,Clothing,Kids,Lee LLC,Manager nice within heavy.,653.23,319.83,87,90,45,1,2024-03-03,2026-01-16 15:24:57.367336
1782,Represent Laptops,Electronics,Laptops,Foster PLC,Discover modern lot something avoid fear.,715.59,356.05,21,39,43,0,2023-06-18,2026-01-05 16:45:49.787223
1783,Color Kitchen,Home,Kitchen,"Brooks, Vega and Johnson",Son piece model well.,804.19,454.58,371,48,75,1,2023-11-09,2026-01-15 18:05:01.918040
1784,Suffer Fitness,Sports,Fitness,Duran Inc,Rather thousand car Congress.,33.66,24.15,212,81,72,0,2024-05-11,2026-01-17 05:44:32.909877
1785,Support Decor,Home,Decor,Kidd-Jones,Send investment toward thank sport bad ahead.,428.38,213.56,146,71,83,1,2023-05-01,2026-01-20 05:38:27.026868
1786,Around Kids,Clothing,Kids,"Hernandez, French and Mcgee",Daughter look front type far watch cut far.,398.67,198.53,447,63,49,0,2024-08-07,2026-01-10 06:03:13.804801
1787,Maintain Kitchen,Home,Kitchen,Gomez-Mendez,Economy control able million.,554.76,259.88,135,75,64,0,2023-12-29,2026-01-08 17:25:36.550034
1788,Culture Men,Clothing,Men,Smith-Tapia,Develop top herself agree remain lead.,664.98,357.28,36,40,37,0,2024-01-18,2026-01-14 10:24:10.101423
1789,Its Decor,Home,Decor,Phillips-Patel,Wish lay condition thank produce sign.,451.9,235.3,14,21,85,1,2024-05-26,2026-01-07 08:12:10.562793
1790,Where Men,Clothing,Men,"Poole, Carrillo and Hill",Most create hold green paper member drug shake.,522.58,340.31,160,94,76,0,2024-02-05,2026-01-11 19:55:01.911794
1791,Create Women,Clothing,Women,"Horton, Rice and Hopkins",Loss country happy represent health alone.,245.11,140.92,12,91,77,0,2022-09-01,2026-01-15 18:50:03.214654
1792,Company Men,Clothing,Men,Wong and Sons,Second cultural yourself sing response officer.,101.36,47.15,24,48,32,0,2023-06-19,2026-01-17 23:33:06.269128
1793,Arrive Phones,Electronics,Phones,"Garcia, Moon and Calhoun",Training not employee serious edge.,635.09,362.06,46,68,19,0,2024-01-29,2026-01-20 18:00:44.962689
1794,So Women,Clothing,Women,Austin Ltd,Former skin local.,400.41,215.03,164,90,100,0,2023-05-16,2026-01-07 16:02:16.266329
1795,Offer Accessories,Electronics,Accessories,Chapman Ltd,Meeting painting involve weight production.,728.36,338.46,187,47,27,1,2022-06-23,2026-01-15 01:20:40.287719
1796,Move Furniture,Home,Furniture,Tucker and Sons,Off second need hard picture tax parent.,284.98,166.41,66,77,63,0,2023-10-10,2026-01-17 06:46:03.730171
1797,Develop Outdoor,Sports,Outdoor,Pratt-Gonzalez,Worry night question sort interesting create.,1064.57,499.0,187,97,56,0,2024-04-21,2026-01-19 00:12:57.909198
1798,Television Fitness,Sports,Fitness,Osborn Ltd,Guess tell item year best million past when.,871.95,458.68,151,65,64,0,2023-08-15,2026-01-03 17:11:11.265828
1799,Maybe Decor,Home,Decor,Sims Inc,Toward imagine another prove speak effort cut.,625.64,287.17,13,63,42,0,2023-01-02,2026-01-05 18:58:30.581235
1800,Military Outdoor,Sports,Outdoor,Campos-Meadows,Trip show leg large appear.,530.17,283.76,226,34,39,0,2024-05-25,2026-01-18 06:22:43.087610
1801,Itself Furniture,Home,Furniture,"Foster, Flowers and Andrews",Break easy agree century art.,524.63,281.78,482,40,89,0,2023-10-12,2026-01-14 18:47:50.783624
1802,Take Kids,Clothing,Kids,"Hill, Powers and Mcclure",Recently score magazine argue.,900.51,427.35,73,27,59,0,2024-03-28,2026-01-07 13:20:52.310547
1803,Follow Laptops,Electronics,Laptops,Peterson LLC,Bill generation large small soon.,453.17,326.81,34,98,81,0,2023-08-04,2026-01-07 19:34:02.391369
1804,Drug Laptops,Electronics,Laptops,Valdez-Lane,Seat feeling interesting road listen.,682.48,416.95,151,57,41,0,2024-06-29,2026-01-01 18:08:54.947952
1805,Region Phones,Electronics,Phones,"Bray, Munoz and Collins",American kitchen family check ever amount.,50.61,24.98,69,80,81,1,2023-06-19,2026-01-09 04:33:53.316039
1806,Find Kitchen,Home,Kitchen,Dennis-Mathis,Peace modern certainly leg either same.,185.37,105.23,396,90,19,0,2024-03-10,2026-01-02 19:17:25.811785
1807,Spend Phones,Electronics,Phones,Roth-Rodgers,Clearly painting top manage. Show once provide.,670.21,412.15,439,50,23,0,2023-02-28,2026-01-17 18:08:33.723267
1808,Girl Kids,Clothing,Kids,"Bray, Ward and Barber",Case later they week economic throughout.,1036.87,496.05,146,21,95,0,2022-10-14,2026-01-08 13:54:22.157534
1809,Between Women,Clothing,Women,"Johnson, Davis and Booker",Us like nothing arrive growth fall result else.,226.7,120.61,406,22,74,0,2024-12-24,2026-01-12 19:19:40.551770
1810,Relate Phones,Electronics,Phones,Morris-Barrera,Less control such test hospital today.,551.35,399.62,282,24,47,0,2023-06-18,2026-01-08 07:47:50.026076
1811,Whatever Kitchen,Home,Kitchen,"Henderson, Hall and Delacruz",Tell born rather program.,525.48,287.98,31,23,37,1,2022-11-18,2026-01-03 15:08:45.488696
1812,Part Furniture,Home,Furniture,"Clark, Reynolds and Diaz",Happen idea tree attorney my.,153.62,72.47,121,39,42,0,2023-06-01,2026-01-11 10:36:32.522670
1813,Situation Outdoor,Sports,Outdoor,Collins-Schneider,Save face community tree reach better.,100.73,47.74,44,34,27,0,2023-04-10,2026-01-13 05:59:56.888670
1814,Tax Women,Clothing,Women,Waters LLC,Although talk million page reflect two school.,778.57,401.52,242,28,26,0,2023-07-23,2026-01-07 21:57:52.980806
1815,Phone Fitness,Sports,Fitness,Davenport-Hoffman,Couple story radio turn human.,157.95,92.07,279,73,12,0,2022-01-27,2026-01-07 19:10:20.190288
1816,Research Outdoor,Sports,Outdoor,"Brown, Lynch and Oliver",Enjoy month thing sea.,210.54,148.73,393,34,20,0,2024-01-07,2026-01-18 15:57:28.937730
1817,Natural Kids,Clothing,Kids,"Cox, Smith and Moran",Mention perform them teach back.,91.92,47.72,104,84,11,0,2022-02-15,2026-01-07 08:50:57.790530
1818,Animal Phones,Electronics,Phones,Robbins-Ramirez,Great enter want range. Six test yard yourself.,308.0,148.55,286,24,21,0,2023-06-28,2026-01-12 01:41:29.885094
1819,Create Accessories,Electronics,Accessories,"Guzman, Moore and Glenn",Film current shoulder pass PM.,322.53,193.02,414,66,21,0,2024-08-10,2026-01-08 17:14:41.740023
1820,Town Accessories,Electronics,Accessories,Logan Ltd,How price place shoulder play various wrong.,106.02,58.31,302,24,66,0,2024-06-08,2026-01-10 22:23:33.810296
1821,Drug Accessories,Electronics,Accessories,Lee Group,Risk raise away get.,178.57,112.39,493,91,94,0,2022-01-31,2026-01-05 09:36:50.876748
1822,Necessary Laptops,Electronics,Laptops,Church LLC,Congress help another activity nation.,724.5,479.75,220,100,52,1,2022-05-27,2026-01-03 04:41:53.954746
1823,Them Laptops,Electronics,Laptops,Butler-Romero,Study term number ago.,945.02,487.03,356,28,62,0,2023-03-05,2026-01-19 23:52:32.843722
1824,Whether Accessories,Electronics,Accessories,"Hayden, King and Williams",Fall top attack stage.,202.15,112.74,288,31,80,0,2024-11-25,2026-01-17 00:48:17.506134
1825,Against Indoor,Sports,Indoor,Chandler-Silva,Study camera cost purpose. If police today.,46.12,22.7,15,34,31,0,2024-01-01,2026-01-17 09:01:53.863200
1826,Party Men,Clothing,Men,"Martinez, Kelly and Smith",Radio she available week personal prepare.,837.59,382.9,139,53,76,0,2024-01-30,2026-01-02 03:30:33.497307
1827,Poor Outdoor,Sports,Outdoor,Perry-Castillo,Million physical soldier southern.,656.11,479.28,457,86,61,1,2024-07-22,2026-01-20 18:45:55.648620
1828,Speech Furniture,Home,Furniture,Fitzpatrick LLC,Seem reason girl beyond them.,723.09,414.06,177,39,46,1,2024-07-26,2026-01-14 01:40:20.907372
1829,Picture Men,Clothing,Men,"Wilson, Campbell and Cortez",Speech ready consider ahead event your yet.,69.26,42.24,382,46,16,1,2022-07-30,2026-01-15 21:51:18.070951
1830,Sport Phones,Electronics,Phones,Walker Ltd,Training environmental mission state probably.,720.0,332.76,257,29,12,0,2022-03-03,2026-01-07 10:52:54.119740
1831,Bag Decor,Home,Decor,Thomas Group,West answer blue fear contain although.,825.26,378.75,497,23,25,1,2023-10-21,2026-01-15 04:30:32.632472
1832,Seek Men,Clothing,Men,Anderson-Anderson,Beat body without later.,448.07,215.14,11,21,45,0,2024-01-26,2026-01-15 22:59:10.789943
1833,Apply Fitness,Sports,Fitness,Davenport-Brennan,While should pressure keep. Capital every decide.,937.94,432.02,203,97,32,0,2023-11-05,2026-01-16 05:45:14.727218
1834,Item Men,Clothing,Men,Kim-Strickland,Major experience campaign quite half fire lead.,469.01,346.56,252,33,96,0,2023-02-28,2026-01-13 16:01:50.079001
1835,Hair Phones,Electronics,Phones,Faulkner Inc,Star address easy policy mother against eat.,607.56,292.1,33,55,84,0,2023-02-10,2026-01-08 23:14:20.464210
1836,Many Outdoor,Sports,Outdoor,Clark PLC,Have entire play use.,192.17,128.58,110,23,97,1,2022-09-22,2026-01-02 08:04:26.715609
1837,Receive Decor,Home,Decor,Buckley-Lewis,Newspaper three eat left.,610.32,390.27,451,89,89,0,2022-03-01,2026-01-03 10:19:17.750134
1838,Bill Men,Clothing,Men,Moore-Brown,Able plant cell join.,435.52,236.72,2,93,64,0,2022-04-12,2026-01-05 04:29:16.509666
1839,Wife Kids,Clothing,Kids,"Green, Bright and Coleman",Represent measure employee prevent.,678.73,426.2,277,38,88,0,2022-08-08,2026-01-01 06:39:58.915548
1840,Allow Decor,Home,Decor,"Fernandez, Solomon and Lopez",General animal contain reach.,223.13,140.8,445,34,28,0,2023-01-08,2026-01-12 19:43:21.293894
1841,Prevent Outdoor,Sports,Outdoor,"James, Mccoy and Evans",Rise hard study nation really above charge.,1025.64,482.11,265,41,100,0,2024-03-18,2026-01-02 21:11:41.602866
1842,Trip Indoor,Sports,Indoor,Dunn-Tyler,Field Congress show which. Strategy name debate.,579.52,273.62,280,82,26,1,2024-08-04,2026-01-20 00:12:58.522709
1843,Attorney Men,Clothing,Men,"Martinez, Nelson and Williams",Field network here. Test note group similar.,847.84,476.66,16,53,89,0,2023-11-04,2026-01-04 06:37:18.139953
1844,Drug Indoor,Sports,Indoor,Nelson-Wright,Much trial party north.,392.79,222.29,211,73,36,1,2024-07-23,2026-01-05 14:22:47.397439
1845,Green Fitness,Sports,Fitness,Rose-Nelson,Tv weight win evening example large road future.,225.8,136.55,251,31,17,0,2023-12-27,2026-01-21 13:51:49.527048
1846,Through Outdoor,Sports,Outdoor,"Orr, Martinez and Henry",Key trip feel provide loss off.,91.66,57.3,455,41,74,1,2023-12-07,2026-01-07 19:28:29.769572
1847,Hear Indoor,Sports,Indoor,"Mayo, Jones and Jackson",Want laugh past tell place sound treat.,36.01,23.47,262,58,1,0,2023-07-06,2026-01-20 22:18:37.217847
1848,Well Accessories,Electronics,Accessories,Stanton and Sons,Green late assume computer.,594.68,389.25,40,67,57,0,2024-05-20,2026-01-07 00:13:31.303943
1849,Model Accessories,Electronics,Accessories,"Scott, Burton and Boyd",Perform early fire machine financial beat.,237.71,159.24,194,28,10,1,2023-08-29,2026-01-20 20:09:59.194952
1850,Attack Outdoor,Sports,Outdoor,Turner Group,Business sit candidate fly card writer.,91.43,55.48,15,45,49,0,2024-06-25,2026-01-21 04:47:15.436993
1851,Throw Accessories,Electronics,Accessories,Carter-Brown,City there set pass use us everybody.,507.45,305.75,383,22,43,0,2022-10-12,2026-01-02 17:26:43.292126
1852,Something Decor,Home,Decor,Robinson LLC,Begin offer catch yeah religious hand picture.,520.48,317.14,179,53,23,1,2023-11-21,2026-01-04 21:23:13.416354
1853,You Women,Clothing,Women,Jackson-Andrade,White leader building executive son thus.,391.28,255.75,434,49,64,1,2022-02-16,2026-01-15 05:43:21.667619
1854,Develop Laptops,Electronics,Laptops,Rodriguez-Lee,Popular product perhaps trouble either news.,597.99,404.44,449,54,81,0,2024-12-11,2026-01-09 13:53:12.267348
1855,Team Kitchen,Home,Kitchen,"Gutierrez, Moore and Murphy",Can tough during half sister remember.,687.26,424.56,210,74,4,0,2022-08-02,2026-01-11 16:18:22.949706
1856,Adult Men,Clothing,Men,Diaz-Johnson,Six bad off rock which manager after.,589.85,426.36,489,72,83,0,2025-01-14,2026-01-10 22:05:49.557789
1857,Million Women,Clothing,Women,"Hunter, Orr and Ward",Rather tend wait.,840.21,388.84,495,86,49,1,2023-05-05,2026-01-15 05:50:30.021446
1858,Human Decor,Home,Decor,Bean-Watson,Government story conference on college.,93.39,67.23,438,76,96,0,2023-12-21,2026-01-17 02:28:07.142894
1859,Call Fitness,Sports,Fitness,Davis Ltd,Time fund success strong name rest trip.,195.25,119.72,402,27,75,0,2024-03-27,2026-01-21 12:45:27.311011
1860,Also Outdoor,Sports,Outdoor,Cox PLC,Some market magazine green official.,895.23,490.02,132,23,100,0,2024-03-15,2026-01-17 00:46:53.919221
1861,Relate Fitness,Sports,Fitness,Sanchez-Lopez,Prepare treat evidence strong.,746.96,459.77,278,34,9,0,2024-10-29,2026-01-17 14:03:54.209002
1862,You Fitness,Sports,Fitness,Moore-Foster,Garden from east spring government allow within.,820.77,396.41,385,22,31,0,2024-02-12,2026-01-10 07:18:09.234311
1863,Possible Decor,Home,Decor,Aguirre Inc,Simply gas actually bill dog factor beautiful.,291.09,139.65,492,80,60,0,2023-06-06,2026-01-10 12:45:09.186460
1864,May Accessories,Electronics,Accessories,Gomez-York,Cold cup early. Full yes executive book.,432.04,212.89,475,93,43,0,2023-06-18,2026-01-10 03:47:16.210261
1865,Stock Laptops,Electronics,Laptops,Rodriguez-Klein,Husband son personal card move.,745.9,406.59,181,52,37,1,2023-11-10,2026-01-17 02:51:40.538505
1866,Without Fitness,Sports,Fitness,Davis-Burke,Indicate cell board.,239.31,168.01,43,80,90,0,2022-02-05,2026-01-11 00:27:02.842987
1867,Specific Outdoor,Sports,Outdoor,Patterson-Gibbs,Everybody attorney today identify.,348.34,239.95,3,21,15,1,2022-01-28,2026-01-19 11:47:41.968678
1868,Before Accessories,Electronics,Accessories,Mendez Group,Rest safe new simply strong.,736.84,496.45,156,79,75,0,2024-11-11,2026-01-14 16:51:58.505114
